{
  "$schema": "https://json-schema.org/draft/2020-12/schema",
  "$id": "https://metagraph.sh/schemas/subnet-manifest.schema.json",
  "title": "Metagraphed Subnet Manifest",
  "type": "object",
  "additionalProperties": false,
  "required": [
    "schema_version",
    "netuid",
    "name",
    "slug",
    "status",
    "categories",
    "surfaces"
  ],
  "properties": {
    "schema_version": {
      "const": 1
    },
    "netuid": {
      "type": "integer",
      "minimum": 0
    },
    "name": {
      "type": "string",
      "minLength": 1
    },
    "slug": {
      "type": "string",
      "pattern": "^[a-z0-9][a-z0-9-]*$"
    },
    "status": {
      "enum": ["active", "inactive", "unknown"]
    },
    "categories": {
      "type": "array",
      "items": {
        "type": "string"
      },
      "uniqueItems": true
    },
    "docs_url": {
      "type": ["string", "null"],
      "format": "uri"
    },
    "source_repo": {
      "type": ["string", "null"],
      "format": "uri"
    },
    "dashboard_url": {
      "type": ["string", "null"],
      "format": "uri"
    },
    "website_url": {
      "type": ["string", "null"],
      "format": "uri"
    },
    "notes": {
      "type": "string"
    },
    "curation": {
      "$ref": "#/$defs/curation"
    },
    "partnership": {
      "$ref": "#/$defs/partnership"
    },
    "links": {
      "type": "array",
      "items": {
        "$ref": "#/$defs/link"
      }
    },
    "exchange_listings": {
      "type": "array",
      "description": "Curated exchanges where the subnet's token trades — plain registry metadata (Taostats parity), like `links`/`social`. Display-only; never a live-verified surface (no probe/verification) and never feeds completeness.",
      "items": {
        "$ref": "#/$defs/exchange_listing"
      },
      "examples": [
        [
          {
            "exchange": "MEXC",
            "url": "https://www.mexc.com/exchange/TAO_USDT",
            "pair": "TAO/USDT"
          }
        ]
      ]
    },
    "contact": {
      "type": "string",
      "description": "Curated operator support contact (email or public URL, harvested from SubnetIdentitiesV3 subnet_contact) — sanitized at build via subnetContact. Display-only; never feeds completeness."
    },
    "social": {
      "type": "object",
      "additionalProperties": false,
      "description": "Curated social links — wins over on-chain extraction (#745). Display-only; never feeds completeness.",
      "properties": {
        "x": {
          "type": "string",
          "format": "uri",
          "pattern": "^[Hh][Tt][Tt][Pp][Ss]?://([^/?#@]+\\.)?([Xx]\\.com|[Tt]witter\\.com)([:/?#]|$)"
        },
        "telegram": {
          "type": "string",
          "format": "uri",
          "pattern": "^[Hh][Tt][Tt][Pp][Ss]?://([^/?#@]+\\.)?([Tt]\\.me|[Tt]elegram\\.me|[Tt]elegram\\.org)([:/?#]|$)"
        },
        "reddit": {
          "type": "string",
          "format": "uri",
          "pattern": "^[Hh][Tt][Tt][Pp][Ss]?://([^/?#@]+\\.)?[Rr]eddit\\.com([:/?#]|$)"
        },
        "youtube": {
          "type": "string",
          "format": "uri",
          "pattern": "^[Hh][Tt][Tt][Pp][Ss]?://([^/?#@]+\\.)?([Yy]outube\\.com|[Yy]outu\\.be)([:/?#]|$)"
        }
      }
    },
    "baseline_excluded_surface_ids": {
      "type": "array",
      "items": {
        "type": "string",
        "pattern": "^[a-z0-9][a-z0-9-]*$"
      },
      "uniqueItems": true
    },
    "baseline_excluded_surface_urls": {
      "type": "array",
      "items": {
        "type": "string",
        "format": "uri"
      },
      "uniqueItems": true
    },
    "surfaces": {
      "type": "array",
      "items": {
        "$ref": "#/$defs/surface"
      }
    },
    "extensions": {
      "type": "object",
      "additionalProperties": true
    }
  },
  "$defs": {
    "surface": {
      "type": "object",
      "additionalProperties": false,
      "required": [
        "id",
        "name",
        "kind",
        "url",
        "provider",
        "auth_required",
        "authority",
        "public_safe"
      ],
      "properties": {
        "id": {
          "type": "string",
          "pattern": "^[a-z0-9][a-z0-9-]*$"
        },
        "name": {
          "type": "string",
          "minLength": 1
        },
        "kind": {
          "enum": [
            "archive",
            "subtensor-rpc",
            "subtensor-wss",
            "subnet-api",
            "openapi",
            "sse",
            "sdk",
            "example",
            "website",
            "source-repo",
            "dashboard",
            "repo-registry",
            "docs",
            "data-artifact"
          ]
        },
        "url": {
          "type": "string",
          "format": "uri"
        },
        "provider": {
          "type": "string",
          "pattern": "^[a-z0-9][a-z0-9-]*$"
        },
        "auth_required": {
          "type": "boolean"
        },
        "authority": {
          "enum": [
            "official",
            "provider-claimed",
            "community",
            "registry-observed"
          ]
        },
        "public_safe": {
          "type": "boolean"
        },
        "schema_url": {
          "type": "string",
          "format": "uri"
        },
        "schema_status": {
          "enum": ["machine-readable", "ui-only", "not-captured"]
        },
        "source_urls": {
          "type": "array",
          "items": {
            "type": "string",
            "format": "uri"
          },
          "uniqueItems": true
        },
        "verification": {
          "$ref": "#/$defs/verification"
        },
        "review": {
          "type": "object",
          "additionalProperties": false,
          "required": ["state"],
          "description": "Per-surface HUMAN review/governance state for the single-file contribution model: a surface enters as \"community-submitted\"; a maintainer promotes it to \"maintainer-reviewed\" or marks it \"rejected\". Human-governance axis ONLY — machine verification + freshness (live or stale) is the separate probe-derived `verification` overlay (health, last_verified_at, incidents); subnet-level curation has its own `curation.review_state`.",
          "properties": {
            "state": {
              "enum": ["community-submitted", "maintainer-reviewed", "rejected"]
            },
            "submitted_by": {
              "type": "string"
            },
            "submitted_at": {
              "type": "string"
            },
            "confidence": {
              "enum": ["low", "medium", "high"]
            },
            "review_notes": {
              "type": "string"
            }
          }
        },
        "quality_signals": {
          "type": "object",
          "additionalProperties": true
        },
        "rate_limit_notes": {
          "type": "string"
        },
        "rate_limit": {
          "type": "object",
          "additionalProperties": false,
          "required": ["requests", "window"],
          "description": "Structured, curated rate-limit metadata for a callable surface (#747). Integration-only — metagraphed does not enforce it and it never feeds completeness.",
          "properties": {
            "requests": {
              "type": "integer",
              "minimum": 0,
              "description": "Permitted requests per window."
            },
            "window": {
              "type": "string",
              "minLength": 1,
              "description": "Window the request budget applies to, e.g. \"60s\", \"1m\", \"1h\", \"1d\"."
            },
            "burst": {
              "type": "integer",
              "minimum": 0,
              "description": "Optional short-term burst allowance above the steady rate."
            },
            "scope": {
              "enum": ["per-key", "per-ip", "global", "unknown"],
              "description": "What the limit is counted against."
            },
            "cost_notes": {
              "type": "string",
              "description": "Notes on weighted/credit costs or tier differences."
            }
          }
        },
        "auth": {
          "type": ["object", "null"],
          "additionalProperties": false,
          "required": ["scheme"],
          "description": "Structured, caller-actionable auth detail (#746): how to pass a credential. Derived from the OpenAPI securitySchemes when present, else curated. Placeholders only — never a real secret; integration-only, never feeds completeness.",
          "properties": {
            "scheme": {
              "enum": [
                "none",
                "bearer",
                "api-key",
                "basic",
                "oauth2",
                "custom"
              ],
              "description": "Credential scheme."
            },
            "location": {
              "enum": ["header", "query", "cookie"],
              "description": "Where the credential is sent."
            },
            "name": {
              "type": "string",
              "description": "Header or query-parameter name, e.g. \"Authorization\" or \"X-API-Key\"."
            },
            "value_format": {
              "type": "string",
              "description": "Placeholder showing the value shape, e.g. \"Bearer <token>\". Never a real secret."
            },
            "token_url": {
              "type": "string",
              "format": "uri",
              "pattern": "^[Hh][Tt][Tt][Pp][Ss]?://",
              "description": "OAuth2/OIDC token or authorize endpoint, when the spec declares one."
            },
            "scopes_note": {
              "type": "string",
              "description": "Note on required scopes or how to obtain a credential."
            }
          }
        },
        "probe": {
          "$ref": "#/$defs/probe"
        },
        "notes": {
          "type": "string"
        }
      }
    },
    "probe": {
      "type": "object",
      "additionalProperties": false,
      "required": ["enabled", "method", "expect"],
      "properties": {
        "enabled": {
          "type": "boolean"
        },
        "method": {
          "enum": ["GET", "HEAD", "JSON-RPC", "WSS-RPC"]
        },
        "expect": {
          "enum": ["json", "html", "sse", "any"]
        },
        "timeout_ms": {
          "type": "integer",
          "minimum": 1000,
          "maximum": 30000
        }
      }
    },
    "curation": {
      "type": "object",
      "additionalProperties": false,
      "required": ["level", "review_state"],
      "properties": {
        "level": {
          "enum": [
            "native",
            "candidate-discovered",
            "community-seeded",
            "machine-verified",
            "maintainer-reviewed",
            "adapter-backed"
          ]
        },
        "review_state": {
          "enum": [
            "unreviewed",
            "machine-generated",
            "maintainer-reviewed",
            "needs-review",
            "stale"
          ]
        },
        "reviewed_at": {
          "type": ["string", "null"]
        },
        "verified_at": {
          "type": ["string", "null"]
        },
        "source_count": {
          "type": "integer",
          "minimum": 0
        },
        "gap_notes": {
          "type": "array",
          "items": {
            "type": "string"
          }
        }
      }
    },
    "partnership": {
      "type": "object",
      "additionalProperties": false,
      "required": ["tier", "since"],
      "description": "Display/placement metadata — e.g. a featured-pilot slot on the homepage. Distinct from `authority` and `curation.level`, which are trust signals only and never drive placement (docs/adr/0008-subnet-data-model.md).",
      "properties": {
        "tier": {
          "enum": ["pilot"]
        },
        "since": {
          "type": "string",
          "format": "date"
        },
        "validator_hotkey": {
          "type": "string"
        }
      }
    },
    "link": {
      "type": "object",
      "additionalProperties": false,
      "required": ["label", "url"],
      "properties": {
        "label": {
          "type": "string",
          "minLength": 1
        },
        "url": {
          "type": "string",
          "format": "uri"
        },
        "source_url": {
          "type": "string",
          "format": "uri"
        }
      }
    },
    "exchange_listing": {
      "type": "object",
      "additionalProperties": false,
      "required": ["exchange", "url"],
      "description": "A single exchange the subnet's token is listed on. Curated metadata, not a probed surface — the exchange name plus a public listing/trade URL, with an optional trading pair.",
      "properties": {
        "exchange": {
          "type": "string",
          "minLength": 1,
          "description": "Exchange name, e.g. \"MEXC\" or \"Gate.io\"."
        },
        "url": {
          "type": "string",
          "format": "uri",
          "description": "Public listing or trade URL for the token on this exchange."
        },
        "pair": {
          "type": "string",
          "minLength": 1,
          "description": "Optional trading pair identifier, e.g. \"TAO/USDT\"."
        }
      }
    },
    "verification": {
      "type": "object",
      "additionalProperties": true,
      "required": ["classification", "verified_at"],
      "properties": {
        "classification": {
          "enum": [
            "live",
            "redirected",
            "auth-required",
            "dead",
            "unsafe",
            "unsupported",
            "rate-limited",
            "transient",
            "timeout",
            "content-mismatch"
          ]
        },
        "verified_at": {
          "type": "string"
        },
        "status_code": {
          "type": "integer"
        },
        "latency_ms": {
          "type": "integer"
        },
        "confidence_score": {
          "type": "integer",
          "minimum": 0,
          "maximum": 100
        },
        "content_type": {
          "type": ["string", "null"]
        },
        "redirect_target": {
          "type": ["string", "null"],
          "format": "uri"
        }
      }
    }
  }
}
