{
  "categories": [
    "baseline-curated",
    "identity-reviewed",
    "official-docs",
    "official-website",
    "vision",
    "video-intelligence"
  ],
  "curation": {
    "gap_notes": [
      "No verified source repository yet.",
      "No verified OpenAPI/Swagger surface yet.",
      "No verified subnet API surface yet.",
      "No verified SSE/event stream yet.",
      "No verified data artifact yet."
    ],
    "level": "maintainer-reviewed",
    "review_state": "maintainer-reviewed",
    "reviewed_at": "2026-06-07T00:00:00.000Z",
    "source_count": 6,
    "verified_at": "2026-06-08T06:48:46.000Z"
  },
  "dashboard_url": "https://demo.luminar.network/",
  "docs_url": "https://docs.luminar.network/",
  "links": [],
  "name": "Luminar Network",
  "netuid": 87,
  "notes": "Reviewed identity overlay because live chain metadata currently reports a placeholder name for SN87.",
  "schema_version": 1,
  "slug": "sn-87",
  "status": "active",
  "surfaces": [
    {
      "auth_required": false,
      "authority": "official",
      "id": "sn-87-luminar-website",
      "kind": "website",
      "name": "Luminar Network website",
      "notes": "Official project website. The page identifies Luminar Network as Bittensor SN87 and links to official docs and demo surfaces.",
      "probe": {
        "enabled": true,
        "expect": "html",
        "method": "HEAD",
        "timeout_ms": 10000
      },
      "provider": "luminar-network",
      "public_safe": true,
      "quality_signals": {
        "content_type_matches_kind": true,
        "public_safe": true,
        "rate_limited": false,
        "redirected": false,
        "source_tier": "provider-claimed",
        "transient_failure": false
      },
      "source_urls": ["https://luminar.network/"],
      "url": "https://luminar.network/"
    },
    {
      "auth_required": false,
      "authority": "official",
      "id": "sn-87-luminar-docs",
      "kind": "docs",
      "name": "Luminar Network docs",
      "notes": "Official GitBook documentation for Luminar Network.",
      "probe": {
        "enabled": true,
        "expect": "html",
        "method": "HEAD",
        "timeout_ms": 10000
      },
      "provider": "luminar-network",
      "public_safe": true,
      "quality_signals": {
        "content_type_matches_kind": true,
        "public_safe": true,
        "rate_limited": false,
        "redirected": false,
        "source_tier": "provider-claimed",
        "transient_failure": false
      },
      "source_urls": [
        "https://luminar.network/",
        "https://docs.luminar.network/introduction.md"
      ],
      "url": "https://docs.luminar.network/"
    },
    {
      "auth_required": false,
      "authority": "official",
      "id": "sn-87-luminar-demo",
      "kind": "dashboard",
      "name": "Luminar VMS demo",
      "notes": "Public demo app linked from the official Luminar Network website.",
      "probe": {
        "enabled": true,
        "expect": "html",
        "method": "HEAD",
        "timeout_ms": 10000
      },
      "provider": "luminar-network",
      "public_safe": true,
      "quality_signals": {
        "content_type_matches_kind": true,
        "public_safe": true,
        "rate_limited": false,
        "redirected": false,
        "source_tier": "provider-claimed",
        "transient_failure": false
      },
      "source_urls": ["https://luminar.network/"],
      "url": "https://demo.luminar.network/"
    },
    {
      "auth_required": false,
      "authority": "registry-observed",
      "id": "sn-87-taopedia-article",
      "kind": "docs",
      "name": "Luminar Network Taopedia article",
      "notes": "Discovered from the public Taopedia article repository. Not verified as an operational interface.",
      "probe": {
        "enabled": true,
        "expect": "any",
        "method": "HEAD",
        "timeout_ms": 10000
      },
      "provider": "taopedia-articles",
      "public_safe": true,
      "quality_signals": {
        "content_type_matches_kind": true,
        "public_safe": true,
        "rate_limited": false,
        "redirected": false,
        "source_tier": "community-docs",
        "transient_failure": false
      },
      "rate_limit_notes": "Candidate only; no recurring probe is configured until maintainer review.",
      "source_urls": [
        "https://github.com/e35ventura/taopedia-articles/blob/main/content/pages/subnet_87/index.mdx"
      ],
      "url": "https://github.com/e35ventura/taopedia-articles/blob/main/content/pages/subnet_87/index.mdx"
    },
    {
      "auth_required": false,
      "authority": "registry-observed",
      "id": "sn-87-tensorplex-docs",
      "kind": "docs",
      "name": "Luminar Network Tensorplex subnet docs",
      "notes": "Discovered from Tensorplex subnet-docs. Useful as documentation enrichment, not verified operational authority.",
      "probe": {
        "enabled": true,
        "expect": "any",
        "method": "HEAD",
        "timeout_ms": 10000
      },
      "provider": "tensorplex-subnet-docs",
      "public_safe": true,
      "quality_signals": {
        "content_type_matches_kind": true,
        "public_safe": true,
        "rate_limited": false,
        "redirected": false,
        "source_tier": "community-docs",
        "transient_failure": false
      },
      "rate_limit_notes": "Candidate only; no recurring probe is configured until maintainer review.",
      "source_urls": [
        "https://github.com/tensorplex-labs/subnet-docs/blob/main/data/87/subnet.json"
      ],
      "url": "https://github.com/tensorplex-labs/subnet-docs/tree/main/data/87"
    },
    {
      "auth_required": false,
      "authority": "registry-observed",
      "id": "sn-87-taomarketcap-dashboard",
      "kind": "dashboard",
      "name": "Luminar Network TaoMarketCap dashboard",
      "notes": "Universal TaoMarketCap subnet dashboard candidate. Third-party enrichment, not protocol authority.",
      "probe": {
        "enabled": true,
        "expect": "any",
        "method": "HEAD",
        "timeout_ms": 10000
      },
      "provider": "taomarketcap",
      "public_safe": true,
      "quality_signals": {
        "content_type_matches_kind": true,
        "public_safe": true,
        "rate_limited": false,
        "redirected": false,
        "source_tier": "third-party-index",
        "transient_failure": false
      },
      "rate_limit_notes": "Candidate only; no recurring probe is configured until maintainer review.",
      "source_urls": ["https://api.taomarketcap.com/public/v1/subnets/87"],
      "url": "https://taomarketcap.com/subnets/87"
    },
    {
      "auth_required": false,
      "authority": "community",
      "id": "sn-87-luminar-network-source-repo",
      "kind": "source-repo",
      "name": "unknown community source-repo",
      "probe": {
        "enabled": true,
        "expect": "any",
        "method": "HEAD",
        "timeout_ms": 10000
      },
      "provider": "luminar-network",
      "public_safe": true,
      "review": {
        "confidence": "medium",
        "state": "community-submitted",
        "submitted_by": "jsonbored"
      },
      "source_urls": ["https://github.com/Luminar-Network/luminar-sn"],
      "url": "https://github.com/Luminar-Network/luminar-sn"
    },
    {
      "auth_required": false,
      "authority": "community",
      "id": "sn-87-luminar-health",
      "kind": "subnet-api",
      "name": "Luminar Network health",
      "notes": "Public no-auth GET /healthz on luminar.network returning gateway liveness (observed plain-text response: ok). Served on the official SN87 website host registered in this manifest and linked from the Luminar source repository README.",
      "provider": "luminar-network",
      "public_safe": true,
      "review": {
        "state": "community-submitted",
        "submitted_by": "jimcody1995"
      },
      "source_urls": [
        "https://github.com/Luminar-Network/luminar-sn",
        "https://luminar.network/"
      ],
      "url": "https://luminar.network/healthz"
    }
  ],
  "website_url": "https://luminar.network/"
}
