{
  "schema_version": 1,
  "netuid": 115,
  "name": "HashiChain",
  "slug": "sn-115",
  "status": "active",
  "categories": [
    "baseline-curated",
    "identity-reviewed",
    "official-source-repo"
  ],
  "source_repo": "https://github.com/hashi115/hashichain",
  "dashboard_url": "https://taomarketcap.com/subnets/115",
  "website_url": null,
  "notes": "Reviewed overlay for SN115 using the live HashiChain source repository. No standalone website, docs site, API, OpenAPI, SSE, or data artifact has been verified yet.",
  "curation": {
    "level": "maintainer-reviewed",
    "review_state": "maintainer-reviewed",
    "reviewed_at": "2026-06-08T10:50:00.000Z",
    "verified_at": "2026-06-08T10:50:00.000Z",
    "source_count": 4,
    "gap_notes": [
      "No verified standalone website yet.",
      "No verified docs site yet.",
      "No verified machine-readable OpenAPI/Swagger schema yet.",
      "No verified safe public subnet API endpoint yet.",
      "No verified SSE/event stream yet.",
      "No verified standalone static data artifact yet."
    ]
  },
  "surfaces": [
    {
      "id": "sn-115-hashichain-source",
      "name": "HashiChain source repository",
      "kind": "source-repo",
      "url": "https://github.com/hashi115/hashichain",
      "provider": "hashichain",
      "auth_required": false,
      "authority": "official",
      "public_safe": true,
      "source_urls": [
        "https://github.com/hashi115/hashichain",
        "https://api.taomarketcap.com/public/v1/subnets/115"
      ],
      "probe": {
        "enabled": true,
        "method": "HEAD",
        "expect": "any",
        "timeout_ms": 10000
      },
      "notes": "Public HashiChain source repository for SN115."
    },
    {
      "auth_required": false,
      "authority": "community",
      "id": "sn-115-taomarketcap-subnet-api",
      "kind": "subnet-api",
      "name": "HashiChain TaoMarketCap subnet snapshot API",
      "notes": "Public no-auth GET /public/v1/subnets/115 on api.taomarketcap.com returning machine-readable JSON for SN115 on-chain subnet state, SubnetIdentitiesV3 metadata, economics, and dTAO market fields. HashiChain currently has no separately verified first-party public API; this indexed feed is documented in the TaoMarketCap developer API.",
      "provider": "taomarketcap",
      "public_safe": true,
      "review": {
        "state": "community-submitted",
        "submitted_by": "kiannidev"
      },
      "source_urls": [
        "https://api.taomarketcap.com/developer/documentation/",
        "https://github.com/hashi115/hashichain"
      ],
      "url": "https://api.taomarketcap.com/public/v1/subnets/115"
    }
  ],
  "contact": "hashichain@outlook.com"
}
