{
  "schema_version": 1,
  "netuid": 37,
  "name": "Aurelius",
  "slug": "sn-37",
  "status": "active",
  "categories": [],
  "curation": {
    "level": "candidate-discovered",
    "review_state": "unreviewed"
  },
  "surfaces": [
    {
      "id": "sn-37-aurelius-api-docs",
      "name": "Aurelius Central API documentation",
      "kind": "docs",
      "url": "https://new-collector-api-production.up.railway.app/docs",
      "provider": "aurelius",
      "auth_required": false,
      "authority": "community",
      "public_safe": true,
      "source_urls": [
        "https://github.com/Aurelius-Protocol/Aurelius-Protocol/blob/main/README.md"
      ],
      "review": {
        "state": "community-submitted",
        "submitted_by": "glorydavid03023"
      },
      "notes": "Interactive (Swagger UI) documentation for the mainnet (SN37) Aurelius Central API. The official README documents this production host as the finney/mainnet api_url (the -staging host is testnet SN455)."
    },
    {
      "id": "sn-37-aurelius-openapi",
      "name": "Aurelius Central API (OpenAPI)",
      "kind": "openapi",
      "url": "https://new-collector-api-production.up.railway.app/openapi.json",
      "schema_url": "https://new-collector-api-production.up.railway.app/openapi.json",
      "schema_status": "machine-readable",
      "provider": "aurelius",
      "auth_required": false,
      "authority": "community",
      "public_safe": true,
      "source_urls": [
        "https://github.com/Aurelius-Protocol/Aurelius-Protocol/blob/main/README.md",
        "https://new-collector-api-production.up.railway.app/docs"
      ],
      "review": {
        "state": "community-submitted",
        "submitted_by": "nickmopen"
      },
      "notes": "Machine-readable OpenAPI spec for the mainnet (SN37) Aurelius Central API — the same spec the existing /docs Swagger UI renders. The official README documents this production host as the finney/mainnet api_url (the -staging host is testnet SN455)."
    },
    {
      "id": "sn-37-aurelius-subnet-api",
      "name": "Aurelius Central API health",
      "kind": "subnet-api",
      "url": "https://new-collector-api-production.up.railway.app/health",
      "provider": "aurelius",
      "auth_required": false,
      "authority": "community",
      "public_safe": true,
      "source_urls": [
        "https://github.com/Aurelius-Protocol/Aurelius-Protocol/blob/main/README.md",
        "https://new-collector-api-production.up.railway.app/openapi.json"
      ],
      "review": {
        "state": "community-submitted",
        "submitted_by": "kiannidev"
      },
      "notes": "Public no-auth GET returning Central API health (status, db, db_pool, classifier, novelty). Documented in the subnet's own OpenAPI (new-collector-api-production.up.railway.app/openapi.json, path /health); same host as the existing openapi + docs surfaces. The official README documents this production host as the finney/mainnet api_url and recommends curl against /health for connectivity checks."
    },
    {
      "auth_required": false,
      "authority": "community",
      "id": "sn-37-aurelius-work-token-designated-address",
      "kind": "subnet-api",
      "name": "Aurelius work-token designated address API",
      "notes": "Public no-auth GET returning the Central API work-token designated receiving address. Documented in the subnet's own OpenAPI (new-collector-api-production.up.railway.app/openapi.json, path /work-token/designated-address); same host as the existing openapi, docs, and /health subnet-api surfaces. The official README documents this production host as the finney/mainnet api_url.",
      "provider": "aurelius",
      "public_safe": true,
      "review": {
        "state": "community-submitted",
        "submitted_by": "kiannidev"
      },
      "source_urls": [
        "https://new-collector-api-production.up.railway.app/openapi.json",
        "https://github.com/Aurelius-Protocol/Aurelius-Protocol/blob/main/README.md"
      ],
      "url": "https://new-collector-api-production.up.railway.app/work-token/designated-address"
    },
    {
      "auth_required": false,
      "authority": "community",
      "id": "sn-37-aurelius-health-live",
      "kind": "subnet-api",
      "name": "Aurelius Central API liveness health",
      "notes": "Public no-auth GET /health/live returning {\"status\":\"ok\"} for lightweight liveness checks. Documented in the subnet's own OpenAPI (new-collector-api-production.up.railway.app/openapi.json, path /health/live); same host as the existing openapi, docs, /health, and work-token subnet-api surfaces. Distinct from the richer /health endpoint that reports db, db_pool, classifier, and novelty subsystems.",
      "provider": "aurelius",
      "public_safe": true,
      "review": {
        "state": "community-submitted",
        "submitted_by": "kiannidev"
      },
      "source_urls": [
        "https://new-collector-api-production.up.railway.app/openapi.json",
        "https://github.com/Aurelius-Protocol/Aurelius-Protocol/blob/main/README.md"
      ],
      "url": "https://new-collector-api-production.up.railway.app/health/live"
    }
  ],
  "social": {
    "x": "https://x.com/aureliusaligned"
  },
  "contact": "aurelius.subnet@gmail.com",
  "source_repo": "https://github.com/Aurelius-Protocol/Aurelius-Protocol",
  "website_url": "https://aureliusaligned.ai/"
}
