{
  "categories": [],
  "contact": "hello@leadpoet.com",
  "curation": {
    "level": "community-seeded",
    "review_state": "unreviewed"
  },
  "name": "Leadpoet",
  "netuid": 71,
  "schema_version": 1,
  "slug": "sn-71",
  "social": {
    "x": "https://x.com/leadpoetai"
  },
  "source_repo": "https://github.com/leadpoet/leadpoet",
  "status": "active",
  "surfaces": [
    {
      "auth_required": false,
      "authority": "community",
      "id": "sn-71-leadpoet-health-api",
      "kind": "subnet-api",
      "name": "Leadpoet web health API",
      "notes": "Public no-auth GET /api/health on leadpoet.com returning JSON liveness (observed: {\"status\":\"ok\",\"service\":\"leadpoet-web\",...}). Documented in the subnet's own OpenAPI (leadpoet.com/api/openapi.json, path /api/health); same host as the official Leadpoet website linked from the SN71 source repository README.",
      "probe": {
        "enabled": true,
        "expect": "json",
        "method": "GET",
        "timeout_ms": 10000
      },
      "provider": "leadpoet",
      "public_safe": true,
      "review": {
        "state": "community-submitted",
        "submitted_by": "kiannidev"
      },
      "source_urls": [
        "https://leadpoet.com/api/openapi.json",
        "https://github.com/leadpoet/leadpoet"
      ],
      "url": "https://leadpoet.com/api/health"
    },
    {
      "auth_required": false,
      "authority": "community",
      "id": "sn-71-leadpoet-openapi",
      "kind": "openapi",
      "name": "Leadpoet public web API OpenAPI schema",
      "notes": "Public no-auth OpenAPI 3.x schema for the SN71 Leadpoet web API (title \"Leadpoet Public API\", 5 paths) on leadpoet.com. Documents /api/health, /api/contact, and geo lookup routes for agents and prospective customers; same host as the existing health surface.",
      "provider": "leadpoet",
      "public_safe": true,
      "probe": {
        "enabled": true,
        "method": "GET",
        "expect": "json",
        "timeout_ms": 15000
      },
      "review": {
        "state": "community-submitted",
        "submitted_by": "bohdansolovie"
      },
      "schema_status": "machine-readable",
      "schema_url": "https://leadpoet.com/api/openapi.json",
      "source_urls": [
        "https://leadpoet.com/api/health",
        "https://leadpoet.com/api/openapi.json",
        "https://github.com/leadpoet/leadpoet"
      ],
      "url": "https://leadpoet.com/api/openapi.json"
    }
  ],
  "website_url": "https://leadpoet.com/"
}
