{
  "categories": ["baseline-curated", "identity-reviewed", "official-website"],
  "curation": {
    "gap_notes": [
      "No verified docs site yet.",
      "No verified machine-readable OpenAPI/Swagger schema yet.",
      "No verified SSE/event stream yet.",
      "The link-service repo's only other API route (/api/clicks) is explicitly admin-only per its own code comment (401 without an x-admin-key header) -- not a public candidate."
    ],
    "level": "maintainer-reviewed",
    "review_state": "maintainer-reviewed",
    "reviewed_at": "2026-07-15T00:00:00.000Z",
    "source_count": 3,
    "verified_at": "2026-07-15T00:00:00.000Z"
  },
  "dashboard_url": "https://taomarketcap.com/subnets/76",
  "name": "Byzantium",
  "netuid": 76,
  "notes": "Reviewed overlay for SN76 using the official Byzantium website and universal TaoMarketCap dashboard. Public docs/API/common-path candidates currently 404 and are not promoted. Re-review pass (2026-07-15): fixed the source-repo surface, which was misattributed to an unrelated Bittensor subnet's repository (safe-scan-ai/cancer-ai) and never matched the file's own top-level source_repo field -- now points to the correct byzantiumaitao-arch/byzantium repo.",
  "schema_version": 1,
  "slug": "sn-76",
  "social": {
    "x": "https://x.com/byzantiumai"
  },
  "source_repo": "https://github.com/byzantiumaitao-arch/byzantium",
  "status": "active",
  "surfaces": [
    {
      "auth_required": false,
      "authority": "official",
      "id": "sn-76-byzantium-website",
      "kind": "website",
      "name": "Byzantium website",
      "notes": "Official Byzantium website.",
      "probe": {
        "enabled": true,
        "expect": "html",
        "method": "HEAD",
        "timeout_ms": 10000
      },
      "provider": "byzantium",
      "public_safe": true,
      "source_urls": ["https://www.byzantiumai.net/"],
      "url": "https://www.byzantiumai.net/"
    },
    {
      "auth_required": false,
      "authority": "official",
      "id": "sn-76-byzantium-source-repo",
      "kind": "source-repo",
      "name": "Byzantium source repository",
      "notes": "Official SN76 Byzantium source repository -- verified live 2026-07-15. Corrects a prior misattribution: this surface previously pointed to github.com/safe-scan-ai/cancer-ai, an unrelated Bittensor subnet's repo (SafeScan, a cancer-detection subnet with no connection to Byzantium's social-promotion agent theme), which never matched the file's own top-level source_repo field.",
      "probe": {
        "enabled": true,
        "expect": "any",
        "method": "HEAD",
        "timeout_ms": 10000
      },
      "provider": "byzantium",
      "public_safe": true,
      "source_urls": ["https://github.com/byzantiumaitao-arch/byzantium"],
      "url": "https://github.com/byzantiumaitao-arch/byzantium"
    },
    {
      "auth_required": false,
      "authority": "community",
      "id": "sn-76-byzantium-agent-config",
      "kind": "data-artifact",
      "name": "Byzantium miner agent configuration",
      "notes": "Public no-auth JSON miner agent-kit configuration (minerHandle, campaign, linkBase, Farcaster channel targets, posting rate limits, and persona traits) published in the official byzantiumaitao-arch/byzantium repository at ai-agent-kit/byzantium.config.json. Documented in ai-agent-kit/README.md as the primary file miners edit to configure the ElizaOS-based social promotion agent for SN76 click campaigns.",
      "provider": "byzantium",
      "public_safe": true,
      "review": {
        "state": "community-submitted",
        "submitted_by": "petermilord"
      },
      "source_urls": [
        "https://github.com/byzantiumaitao-arch/byzantium/blob/main/ai-agent-kit/README.md",
        "https://github.com/byzantiumaitao-arch/byzantium/blob/main/ai-agent-kit/byzantium.config.json"
      ],
      "url": "https://raw.githubusercontent.com/byzantiumaitao-arch/byzantium/main/ai-agent-kit/byzantium.config.json"
    },
    {
      "auth_required": false,
      "authority": "community",
      "id": "sn-76-byzantium-validator-weights",
      "kind": "subnet-api",
      "name": "Byzantium validator weights API",
      "notes": "Public no-auth JSON feed of per-miner weight values; the subnet's sole public validator endpoint per its route.ts doc-comment.",
      "provider": "byzantium",
      "public_safe": true,
      "review": {
        "state": "community-submitted",
        "submitted_by": "cleanjunc"
      },
      "source_urls": [
        "https://raw.githubusercontent.com/byzantiumaitao-arch/byzantium/main/link-service/app/api/validator/weights/route.ts"
      ],
      "url": "https://link.byzantiumai.net/api/validator/weights"
    },
    {
      "auth_required": false,
      "authority": "community",
      "id": "sn-76-taomarketcap-subnet-api",
      "kind": "subnet-api",
      "name": "Byzantium TaoMarketCap subnet snapshot API",
      "notes": "Public no-auth GET /public/v1/subnets/76/ on api.taomarketcap.com returning machine-readable JSON for SN76 Byzantium on-chain subnet state, SubnetIdentitiesV3 metadata, economics, and dTAO market fields — the indexed subnet-state snapshot feed, complementary to the subnet's first-party validator-weights endpoint. Documented in the TaoMarketCap developer API. TaoMarketCap now enforces a trailing slash (the non-slash path 301s); tracked URL updated to the canonical non-redirecting form. Rejects HEAD (405); probe uses GET.",
      "probe": {
        "enabled": true,
        "expect": "json",
        "method": "GET",
        "timeout_ms": 10000
      },
      "provider": "taomarketcap",
      "public_safe": true,
      "review": {
        "state": "community-submitted",
        "submitted_by": "jaytbarimbao-collab"
      },
      "source_urls": ["https://api.taomarketcap.com/developer/documentation/"],
      "url": "https://api.taomarketcap.com/public/v1/subnets/76/"
    }
  ],
  "website_url": "https://www.byzantiumai.net/"
}
