{
  "schema_version": 1,
  "netuid": 72,
  "name": "StreetVision by NATIX",
  "slug": "sn-72",
  "status": "active",
  "categories": [
    "baseline-curated",
    "computer-vision",
    "data",
    "depin",
    "identity-reviewed",
    "official-docs",
    "official-source-repo",
    "official-website"
  ],
  "docs_url": "https://docs.natix.network/whitepaper",
  "source_repo": "https://github.com/natixnetwork/streetvision-subnet",
  "website_url": "https://www.natix.network/",
  "notes": "Reviewed overlay for SN72 using the official NATIX StreetVision source repository, NATIX website, whitepaper, VX360 product page, and Hugging Face organization.",
  "curation": {
    "level": "maintainer-reviewed",
    "review_state": "maintainer-reviewed",
    "reviewed_at": "2026-06-08T08:35:00.000Z",
    "verified_at": "2026-06-08T08:35:00.000Z",
    "source_count": 8,
    "gap_notes": [
      "No verified machine-readable OpenAPI/Swagger schema yet.",
      "No verified safe public subnet API endpoint yet.",
      "No verified SSE/event stream yet."
    ]
  },
  "surfaces": [
    {
      "id": "sn-72-natix-website",
      "name": "NATIX website",
      "kind": "website",
      "url": "https://www.natix.network/",
      "provider": "natix",
      "auth_required": false,
      "authority": "official",
      "public_safe": true,
      "source_urls": [
        "https://github.com/natixnetwork/streetvision-subnet",
        "https://www.natix.network/"
      ],
      "probe": {
        "enabled": true,
        "method": "HEAD",
        "expect": "html",
        "timeout_ms": 10000
      },
      "notes": "Official NATIX website."
    },
    {
      "id": "sn-72-natix-streetvision-source",
      "name": "StreetVision source repository",
      "kind": "source-repo",
      "url": "https://github.com/natixnetwork/streetvision-subnet",
      "provider": "natix",
      "auth_required": false,
      "authority": "official",
      "public_safe": true,
      "source_urls": ["https://github.com/natixnetwork/streetvision-subnet"],
      "probe": {
        "enabled": true,
        "method": "HEAD",
        "expect": "any",
        "timeout_ms": 10000
      },
      "notes": "Official SN72 StreetVision source repository."
    },
    {
      "id": "sn-72-natix-readme-docs",
      "name": "StreetVision README",
      "kind": "docs",
      "url": "https://github.com/natixnetwork/streetvision-subnet/blob/main/README.md",
      "provider": "natix",
      "auth_required": false,
      "authority": "official",
      "public_safe": true,
      "source_urls": ["https://github.com/natixnetwork/streetvision-subnet"],
      "probe": {
        "enabled": true,
        "method": "HEAD",
        "expect": "any",
        "timeout_ms": 10000
      },
      "notes": "Official StreetVision README."
    },
    {
      "id": "sn-72-natix-whitepaper-docs",
      "name": "NATIX whitepaper",
      "kind": "docs",
      "url": "https://docs.natix.network/whitepaper",
      "provider": "natix",
      "auth_required": false,
      "authority": "official",
      "public_safe": true,
      "source_urls": [
        "https://github.com/natixnetwork/streetvision-subnet",
        "https://docs.natix.network/whitepaper"
      ],
      "probe": {
        "enabled": true,
        "method": "HEAD",
        "expect": "html",
        "timeout_ms": 10000
      },
      "notes": "NATIX whitepaper documentation linked from the official project."
    },
    {
      "id": "sn-72-natix-vx360-page",
      "name": "NATIX VX360 product page",
      "kind": "website",
      "url": "https://www.natix.network/vx360-depin-dashcam",
      "provider": "natix",
      "auth_required": false,
      "authority": "official",
      "public_safe": true,
      "source_urls": [
        "https://github.com/natixnetwork/streetvision-subnet",
        "https://www.natix.network/vx360-depin-dashcam"
      ],
      "probe": {
        "enabled": true,
        "method": "HEAD",
        "expect": "html",
        "timeout_ms": 10000
      },
      "notes": "NATIX product page related to the StreetVision data network."
    },
    {
      "id": "sn-72-natix-huggingface",
      "name": "NATIX Hugging Face organization",
      "kind": "data-artifact",
      "url": "https://huggingface.co/natix-network-org",
      "provider": "natix",
      "auth_required": false,
      "authority": "official",
      "public_safe": true,
      "source_urls": [
        "https://github.com/natixnetwork/streetvision-subnet",
        "https://huggingface.co/natix-network-org"
      ],
      "probe": {
        "enabled": true,
        "method": "HEAD",
        "expect": "html",
        "timeout_ms": 10000
      },
      "notes": "Public NATIX Hugging Face organization linked from the StreetVision README."
    },
    {
      "id": "sn-72-natix-roadwork-dataset",
      "name": "StreetVision roadwork image dataset",
      "kind": "data-artifact",
      "url": "https://huggingface.co/datasets/natix-network-org/roadwork",
      "provider": "natix",
      "auth_required": false,
      "authority": "community",
      "public_safe": true,
      "source_urls": [
        "https://github.com/natixnetwork/streetvision-subnet",
        "https://huggingface.co/natix-network-org"
      ],
      "review": {
        "state": "community-submitted",
        "submitted_by": "glorydavid03023"
      },
      "notes": "Public NATIX StreetVision HuggingFace image+text dataset (~8.5k road/roadwork scenes with structured scene/weather/lighting metadata) backing the SN72 roadwork image-classification task; not gated. The StreetVision README (source) declares the Bittensor subnet and links the natix-network-org HF org that owns it."
    },
    {
      "id": "sn-72-natix-roadwork-rows-api",
      "name": "StreetVision roadwork dataset rows API",
      "kind": "data-artifact",
      "url": "https://datasets-server.huggingface.co/rows?dataset=natix-network-org/roadwork&config=default&split=train&offset=0&length=100",
      "provider": "natix",
      "auth_required": false,
      "authority": "community",
      "public_safe": true,
      "source_urls": [
        "https://github.com/natixnetwork/streetvision-subnet",
        "https://huggingface.co/datasets/natix-network-org/roadwork"
      ],
      "review": {
        "state": "community-submitted",
        "submitted_by": "galuis116"
      },
      "notes": "Public no-auth Hugging Face Datasets Server rows API for the official StreetVision roadwork dataset — returns machine-readable JSON (schema + row records with image/id/width/height/scene metadata), a distinct callable endpoint from the existing HF dataset webpage surface above. Fills the file's gap note for a verified safe public subnet API endpoint."
    },
    {
      "auth_required": false,
      "authority": "community",
      "id": "sn-72-natix-whitepaper-llms-txt",
      "kind": "data-artifact",
      "name": "NATIX whitepaper docs llms.txt index",
      "notes": "Public no-auth machine-readable llms.txt index of the official StreetVision by NATIX (SN72) whitepaper documentation, served at docs.natix.network — the same official docs domain already registered as the sn-72-natix-whitepaper-docs surface and as the file's docs_url. Provides an agent-consumable Markdown map of the NATIX docs (Executive Summary, Introduction, Problem, Solution, xNodes, etc.) for LLM/agent ingestion; content begins '# NATIX Network Whitepaper'. Distinct from the HTML whitepaper docs page (a different URL and a machine-readable text/markdown artifact).",
      "provider": "natix",
      "public_safe": true,
      "review": {
        "state": "community-submitted",
        "submitted_by": "glorydavid03023"
      },
      "source_urls": [
        "https://docs.natix.network/whitepaper",
        "https://github.com/natixnetwork/streetvision-subnet/blob/main/README.md"
      ],
      "url": "https://docs.natix.network/whitepaper/llms.txt"
    },
    {
      "auth_required": false,
      "authority": "community",
      "id": "sn-72-taomarketcap-subnet-api",
      "kind": "subnet-api",
      "name": "StreetVision TaoMarketCap subnet snapshot API",
      "notes": "Public no-auth GET /public/v1/subnets/72 on api.taomarketcap.com returning machine-readable JSON for SN72 StreetVision on-chain subnet state, hyperparameters, economics, and dTAO market fields. NATIX publishes websites, docs, and dataset artifacts but no verified first-party public subnet API endpoint; this indexed feed is documented in the TaoMarketCap developer API.",
      "provider": "taomarketcap",
      "public_safe": true,
      "review": {
        "state": "community-submitted",
        "submitted_by": "reyanthony062001-ops"
      },
      "source_urls": [
        "https://api.taomarketcap.com/developer/documentation/",
        "https://github.com/natixnetwork/streetvision-subnet"
      ],
      "url": "https://api.taomarketcap.com/public/v1/subnets/72"
    }
  ],
  "social": {
    "x": "https://x.com/natixnetwork"
  }
}
